Question,Answer,Category,Crop,Language
फूलों में 'यूरिया' की अंतिम डोज कब दें?,फूल आने की प्रक्रिया शुरू होने पर अंतिम डोज देना लाभकारी है।,Business,Floriculture,hi
फूलों की कटाई के बाद 'इत्र' (Perfume) बनाना?,रजनीगंधा और गुलाब के फूलों से तेल और इत्र निकालना मूल्य संवर्धन का सबसे अच्छा जरिया है।,Business,Floriculture,hi
फूलों में 'बोरॉन' की कमी से फूलों का आकार?,फूल टेढ़े-मेढ़े हो सकते हैं और उनकी पंखुड़ियां फटी हुई दिख सकती हैं।,Business,Floriculture,hi
फूलों की 'पछेती' तुड़ाई में 'मुनाफा'?,सीजन के अंत में मिलने वाले फूल बाजार में ऊँची कीमत दिला सकते हैं।,Business,Floriculture,hi
फूलों में 'खरपतवार' नियंत्रण के लिए 'हुइ'?,लाइनों के बीच छोटे यंत्रों से निराई करना फूलों के लिए प्रभावी है।,Business,Floriculture,hi
फूलों की 'मिट्टी' का पीएच 6.5?,यह फूलों के लिए सबसे आदर्श पीएच है जहाँ पोटाश और फास्फोरस सबसे अच्छे से मिलते हैं।,Business,Floriculture,hi
फूलों में 'सिंचाई' के लिए 'सोलर पंप'?,बड़ी फसल होने के कारण सोलर पंप से लगातार सिंचाई करना बहुत ही किफायती है।,Business,Floriculture,hi
फूलों की खुदाई के बाद क्या मूंग संभव है?,"हाँ, फूलों के बाद जायद मूंग बोना मिट्टी की उर्वरता के लिए बहुत अच्छा है।",Business,Floriculture,hi
फूलों में 'जिंक' की कमी से फूलों का स्वाद (गंध)?,पोषक तत्वों की कमी से फूलों की सुगंध और गुणवत्ता पर बुरा असर पड़ता है।,Business,Floriculture,hi
फूलों की 'शुष्क' खेती में सफलता?,मल्चिंग और ड्रिप सिंचाई का उपयोग ही शुष्क क्षेत्रों में फूल उगाने का राज है।,Business,Floriculture,hi
फूलों में 'पोटाश' की कमी से 'शर्करा' संचय?,पोटाश कम होने पर फूलों की ताजगी और सुगंध कम हो सकती है।,Business,Floriculture,hi
फूलों के भंडारण में 'पारे' की गोली का खतरा?,"भूलकर भी प्रयोग न करें, यह स्वास्थ्य के लिए घातक है।",Business,Floriculture,hi
फूलों में 'यूरिया' की बचत के लिए 'नैनो यूरिया'?,नैनो यूरिया का स्प्रे पौधों की हरियाली और वृद्धि के लिए बहुत प्रभावी है।,Business,Floriculture,hi
फूलों की 'मृदा' की उर्वरता का राज?,भरपूर गोबर की खाद और संतुलित पोषक तत्वों का नियमित प्रयोग।,Business,Floriculture,hi
फूलों की सफल खेती के लिए विशेषज्ञों की अंतिम सलाह?,हमेशा बाजार की मांग और सीजन के अनुसार ही फूलों की बुआई करें।,Business,Floriculture,hi
फूलों में 'मृदा परीक्षण' की आवृत्ति?,हर साल एक बार मिट्टी की जांच करवाएं ताकि पोटाश और जिंक का सही स्तर पता रहे।,Business,Floriculture,hi
फूलों की 'जायद' उत्पादन के लाभ?,"गर्मियों के मौसम में जब शादियां अधिक होती हैं, फूलों की भारी मांग रहती है।",Business,Floriculture,hi
फूलों में 'मैग्नीशियम' की पूर्ति?,मिट्टी में मैग्नीशियम सल्फेट डालकर या स्प्रे करके कमी पूरी करें।,Business,Floriculture,hi
फूलों की 'प्रूनिंग' का सही समय?,गुलाब जैसे झाड़ीदार फूलों में अक्टूबर के महीने में छंटाई करना सबसे अच्छा होता है।,Business,Floriculture,hi
फूलों के भंडारण के लिए 'प्लास्टिक क्रेट्स'?,फूलों को सुरक्षित रखने और मंडी तक ले जाने के लिए क्रेट्स सबसे अच्छे हैं।,Business,Floriculture,hi
फूलों की खेती में 'सफलता' का सबसे बड़ा सूत्र?,सही किस्म का चुनाव + नियमित सिंचाई + बाजार संपर्क ही असली सफलता है।,Business,Floriculture,hi
