Question,Answer,Category,Crop,Language
फूलों की खेती (Floriculture) का परिचय क्या है?,"फूलों को व्यावसायिक उद्देश्यों (सजावट, पूजा, इत्र) के लिए उगाना फूलों की खेती है। यह पारंपरिक फसलों की तुलना में बहुत अधिक मुनाफा देती है।",Business,Floriculture,hi
बिहार में किन फूलों की खेती अधिक होती है?,"मुख्य रूप से गेंदा (Marigold), गुलाब, रजनीगंधा (Tuberose) और ग्लैडियोलस की खेती अधिक की जाती है।",Business,Floriculture,hi
गेंदा (Marigold) की खेती के लिए सबसे अच्छा समय?,"गेंदा साल में तीन बार बोया जा सकता है: मानसून (जून-जुलाई), सर्दी (सितंबर-अक्टूबर) और गर्मी (जनवरी-फरवरी)।",Business,Floriculture,hi
गेंदा की प्रति एकड़ बीज दर?,नर्सरी तैयार करने के लिए लगभग 600-800 ग्राम बीज प्रति एकड़ पर्याप्त होता है।,Business,Floriculture,hi
रजनीगंधा (Tuberose) की खेती कैसे करें?,इसे इसके कंदों (Bulbs) के माध्यम से लगाया जाता है। फरवरी-मार्च का समय इसकी बुआई के लिए सबसे अच्छा है।,Business,Floriculture,hi
गुलाब (Rose) की खेती के लिए 'ग्राफ्टिंग'?,व्यावसायिक खेती के लिए हमेशा 'बडिंग' (Grafting) किए हुए उन्नत किस्म के पौधों का ही चुनाव करें।,Business,Floriculture,hi
ग्लैडियोलस (Gladiolus) की क्या विशेषता है?,यह एक लोकप्रिय कट-फ्लावर (Cut flower) है जिसका उपयोग गुलदस्तों और सजावट में होता है। इसे सर्दियों में उगाया जाता है।,Business,Floriculture,hi
फूलों के लिए कैसी मिट्टी सबसे अच्छी है?,"अच्छी जल निकासी वाली उपजाऊ दोमट मिट्टी जिसका पीएच 6.5 से 7.5 हो, फूलों के लिए श्रेष्ठ है।",Business,Floriculture,hi
फूलों में खाद और उर्वरक की मात्रा?,"फूलों को भरपूर गोबर की खाद, वर्मीकम्पोस्ट और संतुलित एनपीके (19:19:19) की जरूरत होती है।",Business,Floriculture,hi
फूलों में 'पोटाश' का क्या महत्व है?,"पोटाश फूलों के रंग को गहरा बनाता है, डंठल को मजबूत करता है और फूलों की ताजगी (Vase life) बढ़ाता है।",Business,Floriculture,hi
फूलों में सिंचाई का सही तरीका?,फूलों को नियमित और हल्की सिंचाई की जरूरत होती है। ड्रिप सिंचाई फूलों की गुणवत्ता के लिए सबसे अच्छी है।,Business,Floriculture,hi
गेंदा में 'पिंचिंग' (Pinching) क्या है?,पौधे के ऊपरी सिरे को तोड़ना ताकि अधिक शाखाएं निकलें और फूलों की संख्या बढ़ जाए। यह 30-40 दिन की अवस्था पर किया जाता है।,Business,Floriculture,hi
फूलों की तुड़ाई (Harvesting) कब करें?,"खुले फूलों (गेंदा) को पूरी तरह खिलने पर और कट-फ्लावर्स (गुलाब, रजनीगंधा) को कली की अवस्था में सुबह जल्दी तोड़ें।",Business,Floriculture,hi
फूलों की औसत उपज कितनी होती है?,गेंदा से प्रति एकड़ 80-100 क्विंटल और रजनीगंधा से 1.5 से 2 लाख स्टिक्स प्रति एकड़ प्राप्त की जा सकती हैं।,Business,Floriculture,hi
फूलों की प्रमुख उन्नत किस्में?,"गेंदा में पूसा नारंगी, पूसा बसंती; रजनीगंधा में प्रज्वल, सुहासिनी और गुलाब में फर्स्ट प्राइज प्रसिद्ध हैं।",Business,Floriculture,hi
फूलों के भंडारण और पैकेजिंग?,फूलों को ठंडे स्थान पर रखें। गेंदा को जूट के बोरों में और स्टिक्स को कार्डबोर्ड बॉक्स में पैक करें।,Business,Floriculture,hi
फूलों की खेती में सबसे बड़ी चुनौती?,फूलों का जल्दी खराब होना (Perishable nature) और बाजार भाव में बहुत अधिक उतार-चढ़ाव।,Business,Floriculture,hi
क्या फूलों की खेती के लिए सरकारी सब्सिडी मिलती है?,"हाँ, 'एकीकृत बागवानी विकास मिशन' के तहत फूलों के बीज, पॉलीहाउस और कोल्ड स्टोरेज पर 40-50% अनुदान मिलता है।",Business,Floriculture,hi
फूलों की मार्केटिंग कैसे करें?,"स्थानीय मंडियों, मंदिर परिसरों, फूलों की दुकानों या सीधे इवेंट प्लानर्स को बेचकर अधिक लाभ कमाया जा सकता है।",Business,Floriculture,hi
बिहार में फूलों की खेती के प्रमुख केंद्र?,"नालंदा, वैशाली, मुजफ्फरपुर और पटना के आसपास के क्षेत्रों में फूलों की बड़े पैमाने पर खेती होती है।",Business,Floriculture,hi
रजनीगंधा की 'सिंगल' और 'डबल' किस्मों में अंतर?,"सिंगल किस्में अधिक सुगंधित होती हैं और इत्र के लिए अच्छी हैं, जबकि डबल किस्में सजावट के लिए उपयोग होती हैं।",Business,Floriculture,hi
फूलों में 'थ्रिप्स' कीट का प्रबंधन?,नीम तेल या अनुशंसित कीटनाशक का छिड़काव कलियों और फूलों पर करें।,Business,Floriculture,hi
फूलों के बाग में 'मल्चिंग' के लाभ?,नमी बनाए रखना और खरपतवारों को रोकना फूलों के उत्पादन में बहुत सहायक है।,Business,Floriculture,hi
क्या फूलों की खेती 'पॉलीहाउस' (Polyhouse) में करना बेहतर है?,"हाँ, पॉलीहाउस में बेमौसम और उच्च गुणवत्ता वाले फूल (जैसे- जरबेरा, कार्नेशन) उगाकर बहुत अधिक मुनाफा कमाया जा सकता है।",Business,Floriculture,hi
फूलों की खेती शुरू करने वाले नए किसानों के लिए सलाह?,हमेशा बाजार की मांग (शादियों और त्योहारों के सीजन) को देखकर ही फूलों का चुनाव और बुआई करें।,Business,Floriculture,hi
'ग्लैडियोलस' के कंदों का भंडारण?,बीज के लिए कंदों को खुदाई के बाद सुखाकर ठंडे और हवादार स्थान पर रखा जाना चाहिए।,Business,Floriculture,hi
फूलों में 'बोरॉन' की कमी?,फूलों का आकार टेढ़ा-मेढ़ा होना और पंखुड़ियों का फटना बोरॉन की कमी का संकेत है।,Business,Floriculture,hi
फूलों के बाग में 'मधुमक्खी पालन'?,परागण के लिए मधुमक्खियाँ बहुत सहायक होती हैं और शहद से अतिरिक्त आय भी होती है।,Business,Floriculture,hi
फूलों में 'नत्रजन' (Nitrogen) की अधिकता से नुकसान?,पौधे बहुत ऊँचे हो जाते हैं लेकिन फूल कम लगते हैं और उनके गिरने का डर रहता है।,Business,Floriculture,hi
फूलों की खेती में 'पोटाश' की टॉप ड्रेसिंग?,फूल आने की अवस्था (Bud initiation) में पोटाश देने से फूलों का आकार और चमक बढ़ती है।,Business,Floriculture,hi
फूलों के 'अवशेषों' का उपयोग?,खराब और सूखे फूलों से 'प्राकृतिक रंग' बनाए जा सकते हैं या उन्हें सड़ाकर खाद बनाई जा सकती है।,Business,Floriculture,hi
फूलों में 'मैग्नीशियम' की कमी के लक्षण?,पुरानी पत्तियां पीली पड़ जाती हैं और फूलों का रंग फीका हो जाता है।,Business,Floriculture,hi
गुलाब के फूलों में 'गुलकंद' बनाना?,गुलाब की पंखुड़ियों और चीनी के मेल से गुलकंद बनाना मूल्य संवर्धन का एक पारंपरिक और मुनाफे वाला तरीका है।,Business,Floriculture,hi
फूलों में 'फास्फोरस' का महत्व?,जड़ों के विकास और कलियों की संख्या बढ़ाने के लिए फास्फोरस अनिवार्य है।,Business,Floriculture,hi
फूलों की तुड़ाई के समय 'सावधानी'?,फूलों को बहुत सावधानी से डंठल के साथ काटें ताकि टहनी को नुकसान न पहुँचे।,Business,Floriculture,hi
फूलों की 'मृदा' का पीएच मान?,6.0 से 7.0 के बीच का पीएच फूलों की अधिकांश प्रजातियों के लिए सबसे अच्छा है।,Business,Floriculture,hi
फूलों में 'आयरन' (लोहा) की कमी?,नई पत्तियां पूरी तरह पीली पड़ जाती हैं। 0.5% फेरस सल्फेट का छिड़काव करें।,Business,Floriculture,hi
फूलों की फसल में 'पाले' से बचाव?,सर्दियों में फूलों को पाले से बचाने के लिए हल्की सिंचाई और मल्चिंग जरूरी है।,Business,Floriculture,hi
रजनीगंधा की 'प्रज्वल' किस्म की खासियत?,"यह अधिक फूल देने वाली, लंबी स्टिक वाली और रोगों के प्रति सहनशील एक उन्नत किस्म है।",Business,Floriculture,hi
फूलों में 'यूरिया' की मात्रा मिट्टी के अनुसार?,भारी मिट्टी में यूरिया कम किस्तों में और रेतीली मिट्टी में अधिक बार देना बेहतर है।,Business,Floriculture,hi
फूलों के भंडारण में 'नमी'?,तुड़ाई के बाद फूलों को ताज़ा रखने के लिए उनके डंठल को पानी में रखना या ठंडे स्थान पर रखना जरूरी है।,Business,Floriculture,hi
गेंदे के फूलों का 'ड्रायर' में सुखाना?,फूलों को सुखाकर उनका पाउडर बनाना पोल्ट्री फीड और कलर उद्योग के लिए बहुत लाभदायक है।,Business,Floriculture,hi
फूलों में 'सफेद मक्खी' का नियंत्रण?,नीम तेल या पीले चिपचिपे ट्रैप का उपयोग करके इन्हें रोका जा सकता है।,Business,Floriculture,hi
फूलों की खेती में 'नर्सरी' का सही प्रबंधन?,नर्सरी बेड को ऊँचा रखें और कवकनाशी से उपचारित करें ताकि पौधे स्वस्थ रहें।,Business,Floriculture,hi
फूलों को 'चमकदार' बनाने के लिए सूक्ष्म पोषक तत्व?,मल्टी-माइक्रोन्यूट्रिएंट्स का स्प्रे फूलों के रंग और चमक को निखारता है।,Business,Floriculture,hi
फूलों की खेती में 'मजदूरी' कम करने के तरीके?,ड्रिप सिंचाई और प्लास्टिक मल्चिंग से निराई और पानी देने का श्रम बचता है।,Business,Floriculture,hi
फूलों के बीजों में 'अंकुरण' न होने का कारण?,"पुराना बीज, बहुत अधिक गहराई या नर्सरी में बहुत अधिक पानी का जमाव।",Business,Floriculture,hi
फूलों की खेती के लिए सरकारी ट्रेनिंग?,बिहार के उद्यान निदेशालय और जिला स्तर पर 'सेंटर ऑफ एक्सीलेंस' में फूलों की ट्रेनिंग दी जाती है।,Business,Floriculture,hi
फूलों में 'लीफ माइनर' कीट की पहचान?,पत्तियों पर सफेद टेढ़ी-मेढ़ी लकीरें। नीम तेल का छिड़काव करें।,Business,Floriculture,hi
फूलों की 'सघन' बुआई में उपज?,पौधों की संख्या बढ़ाकर उपज बढ़ाई जा सकती है लेकिन हवा का संचार सही होना चाहिए।,Business,Floriculture,hi
फूलों में 'सिंचाई' का अंतराल गर्मियों में?,गर्मी में हर 2-3 दिन में हल्की सिंचाई करना फूलों को सूखने से बचाने के लिए जरूरी है।,Business,Floriculture,hi
फूलों की कटाई के बाद 'खेत' की सफाई?,अगली फसल के लिए पुरानी जड़ों और सूखी टहनियों को हटाकर खेत साफ रखें।,Business,Floriculture,hi
फूलों में 'जिंक' की कमी से फूलों का विकास?,फूल छोटे रह जाते हैं और उनकी पंखुड़ियां पूरी तरह नहीं खुल पातीं।,Business,Floriculture,hi
फूलों की 'अगेती' बुआई के लाभ?,"अगेती फसल जब सीजन की शुरुआत में बाजार आती है, तो बहुत ऊँची कीमत मिलती है।",Business,Floriculture,hi
फूलों में 'पोटाश' की मात्रा मिट्टी परीक्षण के आधार पर?,हमेशा रिपोर्ट के अनुसार ही खाद डालें ताकि पौधों का संतुलित विकास हो।,Business,Floriculture,hi
फूलों के बाग (खेत) में 'चूहों' का प्रबंधन?,"चूहे कोमल तनों और कंदों (रजनीगंधा) को नुकसान पहुँचा सकते हैं, खेत में सफाई रखें।",Business,Floriculture,hi
फूलों में 'यूरिया' को जड़ों के पास ही क्यों डालें?,ताकि पौधा उसे जल्दी सोख सके और वह धूप में बेकार न जाए।,Business,Floriculture,hi
रजनीगंधा की 'सुहासिनी' किस्म?,यह एक डबल किस्म है जो सजावट और लंबे समय तक ताज़ा रहने के लिए प्रसिद्ध है।,Business,Floriculture,hi
फूलों में 'फास्फोरस' के लिए 'एसएसपी' क्यों अच्छा है?,क्योंकि एसएसपी फास्फोरस के साथ कैल्शियम और सल्फर भी प्रदान करता है।,Business,Floriculture,hi
फूलों की कटाई के बाद 'पैकेजिंग' के लिए क्रेट्स?,प्लास्टिक क्रेट्स और कार्डबोर्ड बॉक्स फूलों के सुरक्षित परिवहन के लिए सबसे अच्छे हैं।,Business,Floriculture,hi
फूलों में 'कलम' लगाने के बाद फल (फूल) आने में कितना समय लगता है?,गुलाब की ग्राफ्टेड कलमें 3-4 महीने में फूल देना शुरू कर देती हैं।,Business,Floriculture,hi
फूलों की 'मशीनी' खुदाई?,"कंदों (रजनीगंधा, ग्लैडियोलस) को निकालने के लिए अब छोटे मशीनी यंत्र उपलब्ध हैं।",Business,Floriculture,hi
फूलों में 'सल्फर' की कमी का प्रभाव?,पौधों का विकास धीमा हो जाता है और पत्तियों का रंग हल्का पीला रह सकता है।,Business,Floriculture,hi
फूलों की तुड़ाई के समय 'मिट्टी' सूखी क्यों होनी चाहिए?,ताकि फूलों पर कीचड़ न लगे और वे बाजार के लिए साफ और आकर्षक रहें।,Business,Floriculture,hi
फूलों में 'जिंक सल्फेट' का छिड़काव?,0.5% जिंक सल्फेट का छिड़काव नई पत्तियों के आने के समय करना प्रभावी है।,Business,Floriculture,hi
ग्लैडियोलस की 'अमेरिकन ब्यूटी' किस्म?,यह अपने बड़े और आकर्षक रंगों वाले फूलों के लिए जानी जाती है।,Business,Floriculture,hi
फूलों में 'चूहों' के बिलों में 'धुआं'?,तनों की जड़ों को बचाने के लिए चूहों को भगाना जरूरी है।,Business,Floriculture,hi
फूलों की कटाई के बाद 'ग्रेडिंग' का लाभ?,"आकार, रंग और डंठल की लंबाई के आधार पर अलग करने से बहुत अच्छे दाम मिलते हैं।",Business,Floriculture,hi
फूलों में 'पोटाश' की कमी से पंखुड़ियों की मजबूती?,फूल जल्दी कुम्हला जाते हैं और परिवहन के समय झड़ सकते हैं।,Business,Floriculture,hi
फूलों की खेती में 'जल निकास' अनिवार्य क्यों है?,जड़ों के पास पानी रुकने से फफूंद रोगों का खतरा बढ़ जाता है और पौधा सूख सकता है।,Business,Floriculture,hi
फूलों में 'खरपतवार' नियंत्रण के लिए 'मल्चिंग'?,फूलों में प्लास्टिक मल्चिंग खरपतवार रोकने और नमी बचाने के लिए श्रेष्ठ है।,Business,Floriculture,hi
फूलों की सिंचाई के लिए 'ड्रिप' और 'बाढ़' (Flood) में तुलना?,ड्रिप सिंचाई 50% पानी बचाती है और फूलों के आकार को एक समान रखती है।,Business,Floriculture,hi
फूलों में 'एनपीके 19:19:19' का छिड़काव कब करें?,पौधों के शुरुआती विकास और कलियाँ निकलने के समय इसका स्प्रे करें।,Business,Floriculture,hi
फूलों की कटाई के बाद 'खेत' की गहरी जुताई?,मिट्टी की संरचना सुधारने और कीटों को नष्ट करने के लिए गहरी जुताई जरूरी है।,Business,Floriculture,hi
फूलों में 'दीमक' के लिए 'नीम की खली'?,मिट्टी की तैयारी के समय 1-2 क्विंटल नीम खली प्रति एकड़ डालें।,Business,Floriculture,hi
गेंदे की 'पूसा नारंगी' किस्म?,यह अधिक फूल देने वाली और गहरे नारंगी रंग की एक बहुत ही लोकप्रिय किस्म है।,Business,Floriculture,hi
फूलों में 'मैंगनीज' की कमी का कारण?,अत्यधिक बलुई मिट्टी या चूना युक्त मिट्टी में इसकी कमी देखी जा सकती है।,Business,Floriculture,hi
फूलों की 'सघन' खेती में 'हवा का संचार'?,पौधों के बीच पर्याप्त दूरी रखने से बीमारियां कम फैलती हैं।,Business,Floriculture,hi
