Question,Answer,Category,Crop,Language
सिंचाई (Irrigation) का कृषि में क्या महत्व है?,फसलों को उनकी आवश्यकतानुसार समय-समय पर कृत्रिम रूप से पानी देना सिंचाई कहलाता है। यह पोषक तत्वों को सोखने और पौधों की वृद्धि के लिए अनिवार्य है।,Irrigation,General,hi
सिंचाई की प्रमुख विधियाँ कौन सी हैं?,"मुख्य विधियाँ हैं: सतही सिंचाई (Flood), ड्रिप (टपक), स्प्रिंकलर (फुहारा) और मेड़-नाली सिंचाई।",Irrigation,General,hi
ड्रिप सिंचाई (Drip Irrigation) क्या है?,इस विधि में पाइप और एमिटर की मदद से पानी को सीधे पौधों की जड़ों में बूंद-बूंद करके दिया जाता है। इससे पानी की 50-70% बचत होती है।,Irrigation,General,hi
स्प्रिंकलर सिंचाई (Sprinkler Irrigation) के क्या लाभ हैं?,यह विधि बारिश की तरह छिड़काव करती है। यह ऊबड़-खाबड़ जमीन और रेतीली मिट्टी के लिए सबसे अच्छी है।,Irrigation,General,hi
बाढ़ सिंचाई (Flood Irrigation) के नुकसान क्या हैं?,"इसमें पानी की बहुत बर्बादी होती है, पोषक तत्व मिट्टी के नीचे बह जाते हैं और जलभराव का खतरा रहता है।",Irrigation,General,hi
मेड़-नाली सिंचाई (Furrow Irrigation) कब उपयोगी है?,"यह आलू, गन्ना और सब्जियों जैसी फसलों के लिए उपयुक्त है जहाँ पानी सीधे तने के संपर्क में नहीं आता।",Irrigation,General,hi
फसलों की सिंचाई के लिए 'क्रांतिक अवस्था' (Critical Stage) क्या है?,"वह समय जब फसल को पानी की सबसे अधिक जरूरत होती है, जैसे- गेहूं में CRI अवस्था और धान में फूल आने का समय।",Irrigation,General,hi
धान में सिंचाई का प्रबंधन कैसे करें?,"धान में 2-5 सेमी पानी बना रहना चाहिए, लेकिन कल्ले निकलने के समय पानी थोड़ा कम करना फायदेमंद होता है।",Irrigation,General,hi
गेहूं में पहली सिंचाई कब करें?,बुआई के 21 से 25 दिन बाद (Crown Root Initiation अवस्था) पहली सिंचाई करना सबसे महत्वपूर्ण है।,Irrigation,General,hi
क्या खारे पानी (Saline Water) से सिंचाई की जा सकती है?,"हल्का खारा पानी कुछ फसलों (जैसे- सरसों, जौ) के लिए उपयोग किया जा सकता है, लेकिन यह मिट्टी का स्वास्थ्य बिगाड़ सकता है।",Irrigation,General,hi
मल्चिंग (Mulching) सिंचाई में कैसे मदद करती है?,"मिट्टी की सतह को ढकने से वाष्पीकरण कम होता है, जिससे सिंचाई का अंतराल बढ़ जाता है और पानी की बचत होती है।",Irrigation,General,hi
प्लास्टिक मल्चिंग के क्या लाभ हैं?,"यह खरपतवारों को रोकता है, मिट्टी की नमी बनाए रखता है और फलों को सड़ने से बचाता है।",Irrigation,General,hi
लेजर लैंड लेवलर (Laser Land Leveler) का सिंचाई में महत्व?,यह खेत को पूरी तरह समतल कर देता है जिससे पानी पूरे खेत में एक समान और तेजी से फैलता है।,Irrigation,General,hi
ड्रिप सिंचाई पर सरकारी सब्सिडी कितनी है?,प्रधानमंत्री कृषि सिंचाई योजना (PMKSY) के तहत छोटे किसानों को 75-90% तक सब्सिडी दी जाती है।,Irrigation,General,hi
वाटर हार्वेस्टिंग (Water Harvesting) क्या है?,बारिश के पानी को तालाबों या टैंकों में इकट्ठा करके उसे सूखे के समय सिंचाई के लिए उपयोग करना।,Irrigation,General,hi
फार्म पॉन्ड (Farm Pond) योजना क्या है?,"खेत के एक हिस्से में तालाब बनाकर बारिश का पानी जमा करना, इसके लिए सरकार अनुदान देती है।",Irrigation,General,hi
नहर (Canal) सिंचाई के क्या लाभ हैं?,यह सिंचाई का सबसे सस्ता स्रोत है और नहर के पानी के साथ आने वाली गाद मिट्टी को उपजाऊ बनाती है।,Irrigation,General,hi
ट्यूबवेल (Tube well) सिंचाई की समस्या?,"भूजल स्तर का लगातार नीचे जाना एक बड़ी समस्या है, इसलिए अब सोलर पंपों को बढ़ावा दिया जा रहा है।",Irrigation,General,hi
सोलर पंप (Solar Pump) के लाभ?,इससे बिजली और डीजल का खर्च शून्य हो जाता है और दिन के समय सिंचाई करना आसान होता है।,Irrigation,General,hi
क्या अधिक सिंचाई से मिट्टी खराब हो सकती है?,"हाँ, अधिक पानी से मिट्टी लवणीय (Saline) हो सकती है और जड़ों को ऑक्सीजन नहीं मिलती।",Irrigation,General,hi
पाइप लाइन सिंचाई (Pipe Irrigation) का महत्व?,खुली नालियों की तुलना में पाइप से पानी ले जाने पर 20-30% पानी की बर्बादी रुकती है।,Irrigation,General,hi
क्या पौधों को 'रात' में सिंचाई करनी चाहिए?,"सर्दियों में रात में सिंचाई पाले से बचाती है, लेकिन सब्जियों में रात की सिंचाई फफूंद रोगों को बढ़ा सकती है।",Irrigation,General,hi
फसलों में 'नमी' की जांच कैसे करें?,"मिट्टी को हाथ में लेकर लड्डू बनाएं, यदि वह बिखर जाए तो सिंचाई की जरूरत है।",Irrigation,General,hi
रेन गन (Rain Gun) सिंचाई क्या है?,यह एक शक्तिशाली फुहारा है जो एक ही स्थान से बड़े क्षेत्र (आधा से एक एकड़) में सिंचाई कर सकता है।,Irrigation,General,hi
ड्रिप सिंचाई के फिल्टर (Filters) की सफाई क्यों जरूरी है?,ताकि मिट्टी और गंदगी से पाइप के छेद (Emitters) बंद न हों।,Irrigation,General,hi
असिंचित खेती (Dryland Farming) में पानी की बचत?,"कम पानी वाली फसलें बोएं, मल्चिंग करें और जीवन रक्षक सिंचाई का प्रबंध रखें।",Irrigation,General,hi
क्या ड्रिप सिंचाई सभी फसलों के लिए उपयुक्त है?,"हाँ, अब गेहूं, मक्का और धान के लिए भी विशेष ड्रिप सिस्टम उपलब्ध हैं।",Irrigation,General,hi
सिंचाई के पानी की गुणवत्ता कैसे जांचें?,नजदीकी मिट्टी और जल परीक्षण प्रयोगशाला में पानी के नमूने की जांच करवाएं।,Irrigation,General,hi
खेत में जल निकास (Drainage) क्यों जरूरी है?,अत्यधिक वर्षा या सिंचाई के बाद अतिरिक्त पानी निकालना जड़ों को सड़ने से बचाने के लिए अनिवार्य है।,Irrigation,General,hi
गन्ने में सिंचाई का प्रबंधन?,गर्मियों में हर 10-12 दिन में सिंचाई करें। गन्ने को पूरे जीवन चक्र में अधिक पानी चाहिए।,Irrigation,General,hi
सब्जियों में सिंचाई का नियम?,सब्जियों को हल्की और बार-बार सिंचाई की जरूरत होती है क्योंकि उनकी जड़ें उथली होती हैं।,Irrigation,General,hi
क्या पौधों की पत्तियों पर पानी छिड़कना सही है?,"नर्सरी में यह ठीक है, लेकिन बड़ी फसल में पत्तियों पर पानी रहने से फफूंद रोगों का खतरा बढ़ जाता है।",Irrigation,General,hi
नहर के पानी के उपयोग में सावधानी?,सुनिश्चित करें कि पानी के साथ खरपतवार के बीज आपके खेत में न आएं।,Irrigation,General,hi
सिंचाई और खाद का संबंध?,खाद डालने के तुरंत बाद हल्की सिंचाई करना जरूरी है ताकि पोषक तत्व घुलकर जड़ों तक पहुँच सकें।,Irrigation,General,hi
क्या 'खारा' पानी फसलों को जला सकता है?,"हाँ, अधिक लवणता वाले पानी से पत्तियों के किनारे जलने लगते हैं और विकास रुक जाता है।",Irrigation,General,hi
सिंचाई के लिए 'टेंसियोमीटर' (Tensiometer) का उपयोग?,यह मिट्टी की नमी को सटीक रूप से मापता है और बताता है कि सिंचाई कब करनी चाहिए।,Irrigation,General,hi
स्प्रिंकलर सिंचाई कब नहीं करनी चाहिए?,तेज हवा चलने पर स्प्रिंकलर न चलाएं क्योंकि पानी समान रूप से नहीं गिरेगा।,Irrigation,General,hi
सिंचाई के पाइपों का रख-रखाव?,सीजन खत्म होने के बाद पाइपों को साफ करके छायादार और सुरक्षित स्थान पर रखें।,Irrigation,General,hi
मिट्टी की 'जल धारण क्षमता' (Water Holding Capacity) कैसे बढ़ाएं?,मिट्टी में अधिक मात्रा में गोबर की खाद और जैविक पदार्थ मिलाकर।,Irrigation,General,hi
क्या सिंचाई से कीटों को नियंत्रित किया जा सकता है?,"हाँ, कुछ कीटों (जैसे दीमक) को अधिक पानी देकर खेत से भगाया जा सकता है।",Irrigation,General,hi
मिट्टी के पीएच (pH) पर सिंचाई का प्रभाव?,लगातार खारे पानी से सिंचाई करने से मिट्टी का पीएच बढ़ सकता है।,Irrigation,General,hi
सिंचाई के लिए 'वाटर बजटिंग'?,अपनी उपलब्ध पानी की मात्रा के अनुसार ही फसलों का चुनाव करना वाटर बजटिंग है।,Irrigation,General,hi
क्या ड्रिप सिंचाई से खरपतवार कम होते हैं?,"हाँ, क्योंकि पानी केवल पौधे की जड़ के पास गिरता है, जिससे खाली जगह में घास नहीं उगती।",Irrigation,General,hi
सिंचाई के बाद 'निराई-गुड़ाई' का लाभ?,इससे मिट्टी की ऊपरी परत टूट जाती है (Mulching effect) और नमी लंबे समय तक बनी रहती है।,Irrigation,General,hi
क्या पौधों को बहुत ठंडा पानी देना चाहिए?,"नहीं, सीधे गहरे ट्यूबवेल का बहुत ठंडा पानी कुछ कोमल पौधों को तनाव (Shock) दे सकता है।",Irrigation,General,hi
सिंचाई के लिए 'तालाब' (Pond) का पानी क्यों अच्छा है?,तालाब का पानी सूर्य की धूप से गर्म और ऑक्सीजन युक्त होता है जो पौधों के लिए श्रेष्ठ है।,Irrigation,General,hi
प्रधानमंत्री कृषि सिंचाई योजना (PMKSY) के तहत 'पर ड्रॉप मोर क्रॉप'?,इसका उद्देश्य आधुनिक सिंचाई तकनीकों के जरिए हर बूंद पानी का अधिकतम उपयोग करना है।,Irrigation,General,hi
सिंचाई के यंत्रों के लिए ऋण (Loan)?,सभी सरकारी और सहकारी बैंक सिंचाई बोरिंग और पंप के लिए कम ब्याज पर ऋण देते हैं।,Irrigation,General,hi
सिंचाई की सफलता का मुख्य सूत्र क्या है?,"सही समय, सही मात्रा और सही विधि का चुनाव ही सिंचाई की सफलता का राज है।",Irrigation,General,hi
