Question,Answer,Category,Crop,Language
प्याज में 'खरपतवार' नियंत्रण के लिए 'फसल चक्र'?,प्याज के बाद धान या दलहन लगाने से खरपतवारों का भंडार कम होता है।,Crop,Onion,hi
प्याज की 'मिट्टी' का पीएच 8.0 होने पर?,"ऐसी मिट्टी थोड़ी क्षारीय है, इसमें पोटाश अधिक लेकिन जिंक कम हो सकता है।",Crop,Onion,hi
प्याज में 'सिंचाई' के लिए 'लेजर लेवलिंग' का असर?,समतल खेत में पानी समान रूप से फैलता है जिससे कोई कोना सूखा नहीं रहता।,Crop,Onion,hi
प्याज की खुदाई के बाद 'पत्तियों' का क्या करें?,पत्तियों को सड़ाकर खाद बनाएं या उन्हें मल्चिंग के रूप में उपयोग करें।,Crop,Onion,hi
प्याज में 'जिंक' की कमी से पत्तियों की नोक?,पत्तियों की नोक ऊपर से सूखना शुरू हो जाती है (Tip burn)।,Crop,Onion,hi
प्याज की 'शुष्क' क्षेत्रों में खेती?,जहाँ पानी की कमी हो वहां ड्रिप सिंचाई प्याज की सफल खेती का आधार है।,Crop,Onion,hi
प्याज में 'पोटाश' की कमी से 'शुगर' निर्माण?,कंदों में चीनी की मात्रा कम हो जाती है जिससे उनका स्वाद फीका रहता है।,Crop,Onion,hi
प्याज के भंडारण में 'नमी' से बचाव?,प्याज को हमेशा सूखी जगह पर जमीन से थोड़ा ऊपर उठाकर रखें।,Crop,Onion,hi
प्याज में 'यूरिया' की मात्रा मिट्टी परीक्षण रिपोर्ट के आधार पर?,हमेशा रिपोर्ट में दी गई 'Recommended Dose' का ही पालन करें।,Crop,Onion,hi
प्याज की 'भीमा किरण' किस्म?,यह रबी मौसम की एक बहुत ही उन्नत और टिकाऊ किस्म है।,Crop,Onion,hi
प्याज में 'फास्फोरस' का जड़ों के विस्तार में महत्व?,फास्फोरस जड़ों को मजबूती देता है जिससे कंद मिट्टी से बेहतर पोषण लेते हैं।,Crop,Onion,hi
प्याज की खुदाई के बाद तुरंत 'बिक्री' या 'भंडारण'?,"यदि भाव 10-15 रुपये से कम हों तो भंडारित करें, अधिक होने पर तुरंत बेचें।",Crop,Onion,hi
प्याज में 'कल्ले' बढ़ाने के लिए 'मैग्नीशियम'?,मैग्नीशियम पत्तियों की हरियाली बढ़ाकर कंदों के लिए अधिक भोजन बनाने में मदद करता है।,Crop,Onion,hi
प्याज की 'मशीनी' खुदाई में कंदों की सुरक्षा?,मशीन की गहराई सही सेट करें ताकि प्याज कटने से बच सकें।,Crop,Onion,hi
प्याज में 'सल्फर' की कमी से उपज में कितनी गिरावट?,गंभीर कमी होने पर पैदावार 20-30% तक कम हो सकती है।,Crop,Onion,hi
प्याज की खुदाई के बाद 'खेत' में 'हरी खाद'?,मूंग या लोबिया लगाकर अगली फसल के लिए नाइट्रोजन तैयार करें।,Crop,Onion,hi
प्याज में 'जिंक सल्फेट' 21% की प्रति एकड़ मात्रा?,10 किग्रा प्रति एकड़ मिट्टी में मिलाना प्याज के लिए पर्याप्त है।,Crop,Onion,hi
प्याज की 'राजेंद्र प्याज-1' किस्म?,यह बिहार की मिट्टी और जलवायु के लिए विशेष रूप से विकसित की गई है।,Crop,Onion,hi
प्याज में 'चूहों' के लिए 'स्मोक' विधि?,बिलों में मिर्च या कड़वे धुएं का प्रयोग चूहों को भगाने में मदद करता है।,Crop,Onion,hi
प्याज की खुदाई के बाद कंदों की 'पैकिंग'?,प्याज को जालीदार नेट बैग्स में भरें ताकि वे लंबे समय तक ताजे रहें।,Crop,Onion,hi
प्याज में 'पोटाश' की कमी से छिलके की चमक?,पोटाश की कमी से छिलका फीका और मटमैला दिख सकता है।,Crop,Onion,hi
प्याज की 'मिट्टी' की तैयारी में 'रोटावेटर' के लाभ?,मिट्टी को पूरी तरह बारीक करने के लिए रोटावेटर प्याज के लिए श्रेष्ठ है।,Crop,Onion,hi
प्याज में 'खरपतवार' नियंत्रण के लिए 'ऑक्सीफ्लोरफेन'?,यह प्याज में रोपाई के बाद उपयोग किया जाने वाला एक प्रभावी खरपतवार नाशी है।,Crop,Onion,hi
प्याज की 'सिंचाई' के लिए 'नहर' के पानी की समय सारणी?,नहर के पानी के आने के अनुसार अपनी सिंचाई की योजना पहले से तैयार रखें।,Crop,Onion,hi
प्याज में 'एनपीके 18:18:18' का लाभ?,यह पौधों को तीनों मुख्य तत्व संतुलित मात्रा में प्रदान करता है।,Crop,Onion,hi
प्याज की खुदाई के बाद खेत की 'गहरी जुताई'?,मिट्टी की संरचना सुधारने के लिए हर 2-3 साल में गहरी जुताई जरूरी है।,Crop,Onion,hi
प्याज में 'दीमक' के लिए 'मिट्टी का तेल' न डालें?,"हाँ, यह मिट्टी के स्वास्थ्य और सूक्ष्मजीवों को नष्ट कर देता है।",Crop,Onion,hi
प्याज की 'अर्का कल्याण' किस्म?,यह खरीफ और रबी दोनों मौसमों के लिए एक बहुत अच्छी किस्म है।,Crop,Onion,hi
प्याज में 'मैंगनीज' की कमी से कंदों का भराव?,कंद छोटे और हल्के रह सकते हैं जिससे कुल पैदावार घटती है।,Crop,Onion,hi
प्याज की 'सघन' खेती में 'वायु संचार'?,पौधों के बीच 10 सेमी की दूरी हवा के संचार के लिए उपयुक्त है।,Crop,Onion,hi
प्याज में 'यूरिया' की टॉप ड्रेसिंग के बाद 'हल्की सिंचाई'?,यूरिया डालने के तुरंत बाद सिंचाई करना उसके असर को बढ़ाता है।,Crop,Onion,hi
प्याज की खुदाई के बाद कंदों को 'आग' से बचाना?,खुदाई के स्थान पर सूखी पत्तियों या कूड़े में आग न लगाएं।,Crop,Onion,hi
प्याज में 'बोरॉन' की कमी से कंदों का फटना?,मिट्टी में बोरॉन की कमी कंदों की बाहरी त्वचा को कमजोर कर देती है जिससे वे फट जाते हैं।,Crop,Onion,hi
प्याज की 'पछेती' बुआई में 'उपज' बचाने के लिए?,हमेशा पछेती और गर्मी सहन करने वाली किस्मों का ही चयन करें।,Crop,Onion,hi
प्याज में 'खरपतवार' नियंत्रण के लिए 'हुइ'?,लाइनों के बीच छोटे यंत्रों से निराई करना प्याज के लिए प्रभावी है।,Crop,Onion,hi
प्याज की 'मिट्टी' का पीएच 6.5?,यह प्याज के लिए सबसे श्रेष्ठ पीएच है जहाँ सभी पोषक तत्व आसानी से मिलते हैं।,Crop,Onion,hi
प्याज में 'सिंचाई' के लिए 'वॉटर सेंसर'?,स्मार्ट सिंचाई से पानी की बर्बादी रुकती है और प्याज को सही नमी मिलती है।,Crop,Onion,hi
प्याज की खुदाई के बाद क्या मूंग संभव है?,"हाँ, प्याज के बाद जायद मूंग बोना मिट्टी की सेहत के लिए बहुत अच्छा है।",Crop,Onion,hi
प्याज में 'जिंक' की कमी से दानों का स्वाद?,जिंक की कमी प्याज के पोषण और स्वाद दोनों को प्रभावित करती है।,Crop,Onion,hi
प्याज की 'शुष्क' खेती में सफलता का मंत्र?,मल्चिंग + ड्रिप सिंचाई + संतुलित जैविक खाद का प्रयोग।,Crop,Onion,hi
प्याज में 'पोटाश' की कमी से 'कंदों' की मजबूती?,पोटाश कम होने पर कंद ढीले और पिलपिले रह जाते हैं।,Crop,Onion,hi
प्याज के भंडारण में 'पारे' की गोलियों का नुकसान?,"पारा प्याज को जहरीला बना देता है, इसका उपयोग कभी न करें।",Crop,Onion,hi
प्याज में 'यूरिया' की बचत के लिए 'नैनो यूरिया'?,नैनो यूरिया का छिड़काव यूरिया की लागत को काफी कम कर सकता है।,Crop,Onion,hi
प्याज की 'मृदा' की उर्वरता का भविष्य?,संतुलित खाद और फसल चक्र ही प्याज की खेती को टिकाऊ बनाए रखेंगे।,Crop,Onion,hi
प्याज की सफल खेती के लिए किसानों को अंतिम सलाह?,हमेशा समय पर सिंचाई और कीट प्रबंधन पर विशेष ध्यान दें।,Crop,Onion,hi
