Question,Answer,Category,Crop,Language
मटर में 'जिंक' की कमी से दानों का स्वाद?,पोषक तत्वों की कमी से दानों के स्वाद और मिठास पर बुरा असर पड़ता है।,Crop,Pea,hi
मटर की 'शुष्क' खेती में सफलता?,मल्चिंग और ड्रिप सिंचाई का उपयोग ही शुष्क क्षेत्रों में मटर उगाने का राज है।,Crop,Pea,hi
मटर में 'पोटाश' की कमी से 'शर्करा' संचय?,पोटाश कम होने पर दानों का मीठापन कम हो जाता है।,Crop,Pea,hi
मटर के भंडारण में 'पारे' की गोली का खतरा?,"भूलकर भी प्रयोग न करें, यह स्वास्थ्य के लिए घातक है।",Crop,Pea,hi
मटर में 'यूरिया' की बचत के लिए 'नैनो यूरिया'?,नैनो यूरिया का स्प्रे पौधों की हरियाली और वृद्धि के लिए बहुत प्रभावी है।,Crop,Pea,hi
मटर की 'मृदा' की उर्वरता का राज?,भरपूर गोबर की खाद और संतुलित फास्फोरस का नियमित प्रयोग।,Crop,Pea,hi
मटर की सफल खेती के लिए विशेषज्ञों की अंतिम सलाह?,हमेशा बीज उपचार और सही समय पर बुआई का पूरा ध्यान रखें।,Crop,Pea,hi
मटर में 'मृदा परीक्षण' की आवृत्ति?,हर साल एक बार मिट्टी की जांच करवाएं ताकि फास्फोरस की मात्रा का सही अंदाजा रहे।,Crop,Pea,hi
मटर की 'जायद' उत्पादन संभव है?,"नहीं, मटर मुख्य रूप से रबी (सर्दियों) की ही फसल है।",Crop,Pea,hi
मटर में 'मैग्नीशियम' की पूर्ति?,मिट्टी में मैग्नीशियम सल्फेट डालकर या स्प्रे करके कमी पूरी करें।,Crop,Pea,hi
मटर की 'प्रूनिंग' नहीं की जाती?,"हाँ, मटर में पौधों की छंटाई की जरूरत नहीं होती।",Crop,Pea,hi
मटर के भंडारण के लिए 'प्लास्टिक क्रेट्स'?,फलियों को सुरक्षित रखने और ताज़ा रखने के लिए क्रेट्स सबसे अच्छे हैं।,Crop,Pea,hi
मटर की खेती में 'सफलता' का सबसे बड़ा सूत्र?,सही किस्म का चुनाव + बीज उपचार + नियमित सिंचाई ही असली सफलता है।,Crop,Pea,hi
