Question,Answer,Category,Crop,Language
केले में 'खरपतवार' नियंत्रण के लिए 'ब्रश कटर'?,लाइनों के बीच उगी घास को काटने के लिए मशीनी कटर का उपयोग करें।,Crop,Banana,hi
केले की 'मिट्टी' का पीएच 6.5?,यह केले के लिए सबसे आदर्श पीएच है जहाँ पोटाश और फास्फोरस सबसे अच्छे से मिलते हैं।,Crop,Banana,hi
केले में 'सिंचाई' के लिए 'सोलर पंप'?,बड़ी फसल होने के कारण सोलर पंप से लगातार सिंचाई करना बहुत ही किफायती है।,Crop,Banana,hi
केले की कटाई के बाद क्या मूंग संभव है?,"हाँ, केले के बाद जायद मूंग बोना मिट्टी की उर्वरता के लिए बहुत अच्छा है।",Crop,Banana,hi
केले में 'जिंक' की कमी से फलों का स्वाद?,पोषक तत्वों की कमी से फलों के स्वाद और मिठास पर बुरा असर पड़ता है।,Crop,Banana,hi
केले की 'शुष्क' खेती में सफलता?,मल्चिंग और ड्रिप सिंचाई का उपयोग ही शुष्क क्षेत्रों में केला उगाने का राज है।,Crop,Banana,hi
केले में 'पोटाश' की कमी से 'शर्करा' संचय?,पोटाश कम होने पर फलों में मिठास कम हो जाती है।,Crop,Banana,hi
केले के भंडारण में 'पारे' की गोली का खतरा?,"भूलकर भी प्रयोग न करें, यह स्वास्थ्य के लिए घातक है।",Crop,Banana,hi
केले में 'यूरिया' की बचत के लिए 'नैनो यूरिया'?,नैनो यूरिया का स्प्रे पौधों की हरियाली और वृद्धि के लिए बहुत प्रभावी है।,Crop,Banana,hi
केले की 'मृदा' की उर्वरता का राज?,भरपूर गोबर की खाद और समय-समय पर जैविक टॉनिक का प्रयोग।,Crop,Banana,hi
केले की सफल खेती के लिए विशेषज्ञों की अंतिम सलाह?,हमेशा टिश्यू कल्चर पौधों का ही चुनाव करें और जल निकास का पूरा ध्यान रखें।,Crop,Banana,hi
केले की 'मालभोग' किस्म के बचाव के उपाय?,पनामा विल्ट से बचाने के लिए स्वस्थ पुत्तियां लें और मिट्टी में ट्राइकोडर्मा का भरपूर प्रयोग करें।,Crop,Banana,hi
केले के गुच्छों का 'वजन' बढ़ाने का तरीका?,"गुच्छे निकलने के बाद अंतिम (नर) फूल को तोड़ दें (Denavelling), इससे फलों का वजन बढ़ता है।",Crop,Banana,hi
केले में 'मिट्टी की जांच' की आवृत्ति?,हर साल एक बार मिट्टी की जांच करवाएं ताकि पोटाश की मात्रा का सही अंदाजा रहे।,Crop,Banana,hi
केले की 'जायद' खेती के लाभ?,"गर्मियों के मौसम में जब ऊर्जा की जरूरत अधिक होती है, केले की अच्छी मांग रहती है।",Crop,Banana,hi
केले में 'मैग्नीशियम' की पूर्ति?,मिट्टी में मैग्नीशियम सल्फेट डालकर या स्प्रे करके कमी पूरी करें।,Crop,Banana,hi
केले की 'प्रूनिंग' (पत्तियों की छंटाई)?,सूखी और रोगग्रस्त पत्तियों को समय-समय पर काटते रहें ताकि हवा का संचार बना रहे।,Crop,Banana,hi
केले के भंडारण के लिए 'प्लास्टिक क्रेट्स'?,फलों को सुरक्षित रखने और पकाने के चैम्बर तक ले जाने के लिए क्रेट्स सबसे अच्छे हैं।,Crop,Banana,hi
केले की खेती में 'सफलता' का सबसे बड़ा सूत्र?,उन्नत किस्म + ड्रिप सिंचाई + संतुलित पोटाश का प्रयोग ही असली सफलता है।,Crop,Banana,hi
