Question,Answer,Category,Crop,Language
मृदा स्वास्थ्य कार्ड की रिपोर्ट कैसे पढ़ें?,"कार्ड में पोषक तत्वों का स्तर (कम, मध्यम, अधिक) देखें और उसके अनुसार ही खाद की मात्रा तय करें।",Fertilizer,General,hi
नाइट्रोजन की अधिकता से 'कीटों' पर प्रभाव?,अधिक नाइट्रोजन वाले पौधों पर रस चूसने वाले कीट (जैसे- एफिड्स) अधिक हमला करते हैं।,Fertilizer,General,hi
क्या फर्टिगेशन से पानी बचता है?,"हाँ, क्योंकि खाद और पानी सीधे जड़ों तक पहुँचते हैं, जिससे बर्बादी न्यूनतम होती है।",Fertilizer,General,hi
अमोनियम सल्फेट का उपयोग कहाँ करें?,यह धान और आलू जैसी फसलों के लिए अच्छा है क्योंकि यह मिट्टी को थोड़ा अम्लीय बनाता है।,Fertilizer,General,hi
क्या उर्वरकों से भूजल प्रदूषित होता है?,"हाँ, नाइट्रोजन वाले उर्वरकों के अत्यधिक प्रयोग से नाइट्रेट रिसकर भूजल में मिल सकता है।",Fertilizer,General,hi
पोटाश की कमी से 'बीमारियां'?,पोटाश कम होने पर पौधों की कोशिका दीवारें कमजोर हो जाती हैं जिससे फफूंद जल्दी हमला करती है।,Fertilizer,General,hi
मिट्टी में 'ह्यूमस' (Humus) का महत्व?,ह्यूमस पोषक तत्वों को रोककर रखता है और मिट्टी की जल धारण क्षमता को कई गुना बढ़ाता है।,Fertilizer,General,hi
क्या खाद डालने के तुरंत बाद बारिश होना अच्छा है?,"हल्की बारिश अच्छी है, लेकिन बहुत तेज बारिश से उर्वरक बहकर खेत से बाहर जा सकते हैं।",Fertilizer,General,hi
एनपीके 19:19:19 का स्प्रे कब करें?,पौधों के शुरुआती विकास (Vegetative phase) के समय इसका स्प्रे सबसे लाभकारी है।,Fertilizer,General,hi
एनपीके 0:52:34 (MKP) का उपयोग?,यह फूल आने और फल बनने के समय फास्फोरस और पोटाश की पूर्ति के लिए श्रेष्ठ है।,Fertilizer,General,hi
एनपीके 13:0:45 का उपयोग?,फल पकते समय इसका छिड़काव फलों की चमक और वजन बढ़ाता है।,Fertilizer,General,hi
क्या जैविक खाद से मिट्टी का पीएच बदलता है?,जैविक खाद मिट्टी के पीएच को संतुलित रखने (Buffer) में मदद करती है।,Fertilizer,General,hi
खारी मिट्टी के लिए सबसे अच्छा उर्वरक?,"ऐसी मिट्टी में यूरिया और एसएसपी का प्रयोग बेहतर है, एमओपी से बचना चाहिए।",Fertilizer,General,hi
क्या उर्वरकों को कीटनाशकों के साथ मिला सकते हैं?,"कुछ रसायनों को मिलाया जा सकता है, लेकिन हमेशा विशेषज्ञ की सलाह लें और जार टेस्ट करें।",Fertilizer,General,hi
चूना (Lime) का उपयोग मिट्टी में क्यों?,अम्लीय (Acidic) मिट्टी के सुधार के लिए और पौधों को कैल्शियम प्रदान करने के लिए।,Fertilizer,General,hi
क्या खाद डालने का कोई 'वैज्ञानिक समय' है?,"हाँ, जब मिट्टी में नमी हो और पौधा सक्रिय रूप से बढ़ रहा हो।",Fertilizer,General,hi
नैनो यूरिया की बोतल को कैसे भंडारित करें?,इसे सीधी धूप से बचाकर ठंडी और सूखी जगह पर रखें। उपयोग से पहले अच्छी तरह हिलाएं।,Fertilizer,General,hi
क्या जैव-उर्वरक रसायनों का विकल्प हैं?,"ये रसायनों की जरूरत को 20-30% कम कर सकते हैं, लेकिन पूरी तरह से विकल्प नहीं हैं।",Fertilizer,General,hi
'प्रेस मड' (Press Mud) खाद क्या है?,चीनी मिलों से निकलने वाला कचरा जो गन्ने और अन्य फसलों के लिए बहुत अच्छा उर्वरक है।,Fertilizer,General,hi
क्या शहरी कचरे से खाद बनाई जा सकती है?,"हाँ, इसे 'कंपोस्टिंग' के जरिए साफ और पोषक तत्वों से भरपूर खाद में बदला जा सकता है।",Fertilizer,General,hi
मिट्टी में 'लोहे' (Iron) की उपलब्धता कैसे बढ़ाएं?,मिट्टी में गोबर की खाद डालें और पीएच मान को 7.0 के पास रखने की कोशिश करें।,Fertilizer,General,hi
पोटाश की कमी से 'दानों' का आकार?,"दाने छोटे, सिकुड़े हुए और वजन में हल्के रह जाते हैं।",Fertilizer,General,hi
क्या खाद को सीधे तने के पास डालना चाहिए?,"नहीं, खाद को हमेशा पौधों की जड़ों से थोड़ी दूर 'रिंग' या 'बैंड' में देना चाहिए।",Fertilizer,General,hi
उर्वरक प्रबंधन में किसानों के लिए मुख्य सलाह?,मृदा परीक्षण के आधार पर 'संतुलित खाद' ही मुनाफे वाली खेती का आधार है।,Fertilizer,General,hi
नैनो यूरिया के साथ क्या यूरिया कम करना चाहिए?,"हाँ, नैनो यूरिया का स्प्रे करने पर यूरिया की टॉप ड्रेसिंग वाली मात्रा 50% कम की जा सकती है।",Fertilizer,General,hi
क्या अधिक खाद से उपज दोगुनी हो सकती है?,"नहीं, एक सीमा के बाद अधिक खाद डालने से उपज नहीं बढ़ती, बल्कि लागत बढ़ती है और मिट्टी खराब होती है।",Fertilizer,General,hi
मिट्टी में 'कैल्शियम' की कमी के लक्षण?,नई पत्तियों के सिरे मुड़ जाते हैं और टहनियां ऊपर से सूखने लगती हैं।,Fertilizer,General,hi
नाइट्रोजन की कमी से 'जड़ों' का विकास?,जड़ें बहुत लंबी लेकिन पतली रह जाती हैं क्योंकि वे भोजन की तलाश में गहराई तक जाती हैं।,Fertilizer,General,hi
क्या बायो-फर्टिलाइजर की एक्सपायरी डेट होती है?,"हाँ, इनमें जीवित बैक्टीरिया होते हैं जो 6-12 महीने बाद मर जाते हैं।",Fertilizer,General,hi
पोटाश के लिए 'नेचुरल' स्रोत?,लकड़ी की राख और केले के छिलके पोटाश के बहुत अच्छे प्राकृतिक स्रोत हैं।,Fertilizer,General,hi
क्या खाद डालने के बाद गोड़ाई जरूरी है?,"हाँ, गोड़ाई करने से खाद मिट्टी में अच्छी तरह मिल जाती है और हवा का संचार बढ़ता है।",Fertilizer,General,hi
पर्ण छिड़काव के लिए पानी की मात्रा?,प्रति एकड़ कम से कम 150-200 लीटर पानी का उपयोग करना चाहिए ताकि फसल पूरी तरह भीग जाए।,Fertilizer,General,hi
उर्वरकों के प्रयोग में 'सुरक्षा'?,खाद डालते समय दस्ताने पहनें और काम खत्म करने के बाद साबुन से अच्छी तरह हाथ धोएं।,Fertilizer,General,hi
भविष्य के 'स्मार्ट' उर्वरक क्या हैं?,धीरे-धीरे घुलने वाले (Slow-release) और नैनो उर्वरक ही भविष्य की कृषि का आधार होंगे।,Fertilizer,General,hi
